Start time,End time,German ><,English!
6518.2,6532.1,"Zögernd geht er auf das Paar zu. Dan nähert sich langsam mit steifen Schritten. Er hat kurzgeschnittenes Haar, ist glatt rasiert und trägt einen hellen Anzug. Seine Begleiterin ist fast einen Kopf kleiner als er. Sie trägt ein lilafarbenes geblümtes Kleid.","Hesitantly, he walks toward the couple. Dan slowly approaches stiffly. He has short hair, is clean-shaven and wearing a light suit. His companion is almost a head smaller than he. She wears a purple flowered dress."
6542.8,6544.1,Er zeigt seine Prothese.,He shows his prosthesis.
6546,6547.3,s Sie steckt in Schuh und Socke.,s you put in shoe and sock.
6566.6,6567.7,Sie gibt ihm die Hand.,She gives him her hand.
6575.6,6580.5,Sie reicht Dan die Hand und küsst ihn auf die Wange. Dan sieht Forrest an. Der schmunzelt stolz.,It ranges Dan's hand and kisses him on the cheek. Dan looks at Forrest. The smiles proudly.
6583.4,6584,Im Garten:,In the garden:
6600.2,6603.4,Trockenes Laub weht über die von mächtigen Bäumen gesäumte Zufahrt.,Dry leaves blowing over the tree-lined drive powerful.
6604.9,6612.9,Zwischen den Bäumen spazieren Jenny und Forrest Händchen haltend auf das Haus zu. Ihr Sohn hebt etwas auf und gibt es seinem Vater. Der nimmt ihn an die Hand.,Between the trees walk Jenny and Forrest holding hands at home. Her son picks up something and there is his father. He takes him by the hand.
6614.5,6625,"Im Haus kommt Forrest mit einem Frühstückstablett ins ehemalige Schlafzimmer seiner Mutter. Abrupt bleibt er stehen und starrt auf Jenny, die reglos im Bett liegt. Ihr Kopf ruht auf mehreren Kissen.","In House Forrest comes with a breakfast tray from his mother's former bedroom. Abruptly, he stops and stares at Jenny, who lies motionless in bed. Her head rests on several pillows."
6626.3,6627.3,Sie öffnet die Augen.,She opens her eyes.
6635.6,6640.7,Er stellt das Tablett auf ein Tischchen neben dem Bett… (ABSTELLEN) … und schiebt ein Fenster hoch.,He puts the tray on a small table next to the bed ... (STOPPING) ... and moves up a window.
6644.6,6648.6,Er setzt sich auf einen Stuhl. Jenny dreht sich zu ihm und stützt den Kopf in die Hand.,He sits down on a chair. Jenny turns to him and supports the head in his hand.
6657.8,6659.1,ss Forrest nachts in Vietnam.,ss Forrest nachts in Vietnam.
6664.5,6667.2,s Er nimmt den Stahlhelm ab und sieht zu einem Wolkenloch am Himmel.,s He takes off his helmet and looks at a hole in the clouds in the sky.
6669,6669.8,Jenny lächelt.,Jenny smiles.
6676.1,6677.1,s Er steht auf dem Kutter.,s He is on a boat.
6681,6682.5,ss In einem See spiegeln sich Gipfel.,ss in a lake peaks reflect.
6683.8,6684.7,ss Er läuft daran entlang,ss It runs along it
6696.2,6698.1,Forrest mit zotteligem Haar und Bart.,Forrest with shaggy hair and beard.
6708.2,6712,Am Bett sieht Forrest abwesend vor sich hin; Jenny blickt versonnen zum Fenster.,On the bed Forrest looks absently to herself; Jenny looks dreamily out of the window.
6716.8,6717.7,Er schaut sie an.,He looks at her.
6721.6,6726.9,"Jenny sieht ihm in die Augen, lächelt traurig und nimmt seine Hand.","Jenny looks him in the eye, smiles sadly and takes his hand."
6732.8,6734.5,Forrest blickt sie zärtlich an.,Forrest looks at her tenderly.
6738.5,6741,"s Er steht am Grabstein, um den ein Kranz aus Steinen liegt.","s He stands at the grave, to the lies a crown of stones."
6754.7,6755.8,Er schaut dabei zu.,He looks at it.
6777.6,6779.8,"s Abends: Er sitzt bei seinem Sohn, der liest",s evening: He is sitting with his son reading
6800.7,6802.2,Auf der Veranda steht eine Platte.,On the porch there is a plate.
6807.4,6810.1,Die Zwei sitzen mit Angelrouten auf dem Baumstumpf am Fluss.,The two sit with fishing rods on the stump by the river.
6839.4,6848.2,Neben einem Blumenstrauß lehnt er den Brief an den Grabstein. Auf dem Umschlag steht in Kinderschrift: 'Mom'. Forrest tritt wieder aus dem Steinkranz und bleibt stehen.,In addition to a bouquet he rejected the letter to the grave stone. On the cover is in child's handwriting: 'Mom'. Forrest exits the stone ring again and stops.
6919.6,6929.1,"Mit gesenktem Kopf entfernt sich Forrest von dem Grab unter der ausladenden Eiche, die auf einer Wiese steht. In der Nähe leuchtet die tiefstehende Sonne in warmem Orange durch eine Baumkrone.",Away with his head down is Forrest under the sprawling oak tree which stands by the grave in a meadow. Near the low sun in warm orange lights by a treetop.
6934.3,6936.4,Hinter Forrest fliegt ein Vogelschwarm vorbei.,Behind Forrest flies past a flock of birds.
6940.4,6941.6,Forrest sieht ihm nach.,Forrest looks after him.
6945.3,6947.8,An der Straße sitzen Vater und Sohn auf einem Baumstumpf.,On the road sitting Father and son on a tree stump.
6950,6952.4,s Er zieht das 'Curious George'-Buch aus der Schultasche.,s He pulls the 'Curious George'-book out of his satchel.
6963.7,6967,s Forrest blättert darin. Die grau-weiße Feder fällt unbemerkt raus.,s Forrest leafs through it. The gray-white feather falls out unnoticed.
6969.7,6971.3,s Er steckt das Buch zurück in die Tasche.,s He puts the book back into his pocket.
6972.9,6976.7,Mit der Tasche über der Schulter und einer Frühstückstüte geht Forrest Junior zur Bustür.,With the bag over her shoulder and a breakfast bag Forrest Junior goes to the bus door.
6992.3,6994.9,"Der Junge sieht zur Busfahrerin hoch, die Kaugummi kaut.","The boy looks up at the bus driver, chewing the gum."
7003.2,7006.1,Sie lacht ihn an. Der Kleine winkt seinem Vater und steigt ein.,She laughs at him. The little waving his father and joins.
7017.2,7018.6,Forrest sieht dem Bus nach.,Forrest looks after the bus.
7023.7,7027,Er setzt sich wieder auf den Baumstumpf und schaut melancholisch vor sich hin.,He sits back on the stump and looks melancholy to himself.
7030.2,7034.2,Forrests Hände ruhen auf seinen Knien.,Forrest's hands resting on his knees.
7034.1,7038,Zwischen seinen Füßen liegt die Feder im Gras. Ein Windstoß wirbelt sie hoch.,Between his feet the spring lies in the grass. A gust of wind swirls high.
7047,7053,Die Feder steigt höher in die Luft. Dabei dreht sie sich sanft. Unten sitzt Forrest immer noch auf dem Baumstumpf.,The spring rises higher into the air. She turns smoothly. Below sits Forrest still on the stump.
7056.8,7060.1,Die Feder fliegt über die Wipfel der mächtigen Bäume an der Zufahrt.,The spring flying over the tops of the mighty trees at the entrance.
7064.5,7067.6,Hoch über der Feder lugt zwischen Wolken der blaue Himmel hindurch.,High above the spring peeping between the clouds through the blue sky.
7071.2,7073.8,Die Feder sinkt etwas herab und wirbelt herum.,The spring descends slightly and whirls around.
7076.2,7077.3,Sie wird wieder angehoben...,They will be raised again ...
7080.3,7081.7,… und schwebt auf die Kamera zu.,... And floats towards the camera.
7083.2,7084.3,Das Bild wird schwarz.,The image is black.